{
  "country_code": "PAK",
  "module": "game_theory_profile",
  "version": "1.0",
  "last_updated": "2026-06-07",
  "summary": "",
  "key_findings": [],
  "metrics": [],
  "claims": [],
  "open_questions": [
    "Populate this module with sourced metrics, claims, and narrative analysis."
  ],
  "source_ids": [],
  "confidence": {
    "overall": "unknown",
    "weak_areas": [
      "metrics",
      "claims",
      "sources"
    ]
  }
}
