{
  "country_code": "ISR",
  "module": "technology_contributions",
  "version": "1.0",
  "last_updated": "2026-06-07",
  "summary": "technology_contributions has 3 structured metric(s) with source metadata. Narrative claims are intentionally empty until sourced research is added.",
  "key_findings": [
    "patent_applications_residents: 1592 applications (2021)",
    "high_technology_exports_current_usd: 19428780000 current_usd (2024)",
    "rd_expenditure_percent_gdp: 6.34589 percent_gdp (2023)"
  ],
  "metrics": [
    {
      "metric_id": "patent_applications_residents",
      "country_code": "ISR",
      "value": 1592,
      "unit": "applications",
      "year": 2021,
      "source_name": "world_bank_wdi",
      "source_url": "https://api.worldbank.org/v2/country/ISR/indicator/IP.PAT.RESD?format=json&per_page=80",
      "retrieved_at": "2026-06-07T00:10:08.825Z",
      "calculation": "IP.PAT.RESD",
      "confidence": "medium",
      "freshness_requirement": "latest_available_year",
      "notes": "Latest non-null World Bank observation for IP.PAT.RESD."
    },
    {
      "metric_id": "high_technology_exports_current_usd",
      "country_code": "ISR",
      "value": 19428780000,
      "unit": "current_usd",
      "year": 2024,
      "source_name": "world_bank_wdi",
      "source_url": "https://api.worldbank.org/v2/country/ISR/indicator/TX.VAL.TECH.CD?format=json&per_page=80",
      "retrieved_at": "2026-06-07T00:10:08.825Z",
      "calculation": "TX.VAL.TECH.CD",
      "confidence": "medium",
      "freshness_requirement": "latest_available_year",
      "notes": "Latest non-null World Bank observation for TX.VAL.TECH.CD."
    },
    {
      "metric_id": "rd_expenditure_percent_gdp",
      "country_code": "ISR",
      "value": 6.34589,
      "unit": "percent_gdp",
      "year": 2023,
      "source_name": "world_bank_wdi",
      "source_url": "https://api.worldbank.org/v2/country/ISR/indicator/GB.XPD.RSDV.GD.ZS?format=json&per_page=80",
      "retrieved_at": "2026-06-07T00:10:08.825Z",
      "calculation": "GB.XPD.RSDV.GD.ZS",
      "confidence": "medium",
      "freshness_requirement": "latest_available_year",
      "notes": "Latest non-null World Bank observation for GB.XPD.RSDV.GD.ZS."
    }
  ],
  "claims": [],
  "open_questions": [
    "Add sourced narrative analysis and claim-level citations for this module."
  ],
  "source_ids": [
    "world_bank_wdi"
  ],
  "confidence": {
    "overall": "medium",
    "weak_areas": [
      "narrative_claims"
    ]
  }
}
